Question,Answer
What does 'prima facie' mean?,"Prima facie is a Latin term meaning 'on its face' or 'at first glance,' indicating that the evidence presented is sufficient to prove a case unless rebutted."
What is 'equity' in legal terms?,"Equity refers to a branch of law that is concerned with fairness and justice, often providing remedies not available in common law."
What is 'mens rea'?,"Mens rea is a Latin term meaning 'guilty mind,' referring to the intent or knowledge of wrongdoing that constitutes part of a crime."
What is 'actus reus'?,"Actus reus is a Latin term meaning 'guilty act,' referring to the physical act or unlawful omission that constitutes a crime."
What is 'contempt of court'?,"Contempt of court is behavior that disrespects or disobeys the authority, justice, and dignity of the court."
What is the role of a 'guardian ad litem'?,A guardian ad litem is a court-appointed individual who represents the best interests of a minor or incapacitated person in legal proceedings.
What is a 'bench trial'?,A bench trial is a trial by a judge rather than a trial by jury.
What is the 'Supreme Court'?,"The Supreme Court is the highest federal court in the United States, with the ultimate judicial authority."
What does 'pro se' mean?,"Pro se is a Latin term meaning 'for oneself,' referring to a person who represents themselves in court without a lawyer."
What is 'pleading the Fifth'?,"Pleading the Fifth refers to invoking the Fifth Amendment right against self-incrimination, refusing to answer questions that could incriminate oneself."
What is 'habeas corpus'?,Habeas corpus is a legal action that allows individuals to seek relief from unlawful detention or imprisonment.
What is 'precedent'?,Precedent is a previous court decision or legal ruling that is binding or persuasive for future cases with similar facts or issues.
What is a 'writ of certiorari'?,A writ of certiorari is an order by a higher court directing a lower court to send the records of a case for review.
What does 'voir dire' mean?,Voir dire is the process of questioning potential jurors to determine their qualifications and suitability to serve on a jury.
What is the 'exclusionary rule'?,The exclusionary rule is a legal principle that excludes evidence obtained in violation of a defendant's constitutional rights from being used in court.
What is 'corporate law'?,"Corporate law is the body of law governing the rights, relations, and conduct of businesses and corporations."
What is 'real property'?,"Real property refers to land and anything permanently attached to it, such as buildings and structures."
What is 'intellectual property law'?,"Intellectual property law is the area of law that deals with protecting the rights of those who create original works, including inventions, designs, and artistic works."
What is a 'tortfeasor'?,"A tortfeasor is a person or entity who commits a tort, causing injury or damage to another."
What is 'common law'?,Common law is law developed through court decisions rather than through legislative statutes.
What is 'summary judgment'?,"Summary judgment is a legal decision made by a court without a full trial, based on the facts that are not in dispute."
What is 'constitutional law'?,Constitutional law is the body of law that interprets and applies the principles and provisions of a constitution.
What is a 'subpoena duces tecum'?,A subpoena duces tecum is a court order requiring a person to produce documents or records for a legal proceeding.
What is a 'bench warrant'?,A bench warrant is a court order issued by a judge for the arrest of a person who has failed to appear in court.
What is 'mediation'?,Mediation is a method of dispute resolution where a neutral third party helps the disputing parties reach a mutually acceptable agreement.
What is a 'judgment' in legal terms?,A judgment is a court's final decision regarding the rights and obligations of the parties in a case.
What is 'strict liability'?,Strict liability is a legal doctrine that holds a party responsible for their actions or products without the need to prove negligence or fault.
What is a 'pleading' in a legal context?,A pleading is a formal written statement submitted by the parties in a lawsuit outlining their claims and defenses.
What is 'contributory negligence'?,Contributory negligence is a legal doctrine that reduces or eliminates a plaintiff's right to recover damages if they were partially at fault for their own injuries.
What is 'corporate veil'?,The corporate veil is a legal concept that separates the actions and liabilities of a corporation from its shareholders.
What is a 'class action'?,A class action is a lawsuit where one or more plaintiffs file a case on behalf of a larger group with similar claims.
What is 'hearsay'?,"Hearsay is an out-of-court statement offered to prove the truth of the matter asserted, generally inadmissible in court due to its lack of reliability."
What is 'res judicata'?,Res judicata is a legal principle that prevents the same parties from litigating the same issue in more than one lawsuit.
What is 'venue' in legal terms?,Venue refers to the geographic location where a legal case is tried and the court with jurisdiction over the matter.
What is 'admissible evidence'?,"Admissible evidence is any document, testimony, or tangible evidence that may be introduced in a court of law."
What is 'breach of duty'?,Breach of duty is the failure to fulfill one's obligations or standard of care in a legal duty.
What is 'dissolution' in the context of business law?,Dissolution is the process of legally closing or ending a business entity.
What is 'alternative dispute resolution' (ADR)?,"Alternative dispute resolution (ADR) encompasses various methods, such as mediation and arbitration, used to resolve disputes outside the traditional court system."
What is a 'writ of execution'?,"A writ of execution is a court order authorizing the enforcement of a judgment, typically involving the seizure of property to satisfy a debt."
What is 'jurisprudence'?,Jurisprudence is the theory or philosophy of law and the study of legal systems and principles.
What is 'prosecutorial discretion'?,"Prosecutorial discretion is the authority of a prosecutor to decide whether to bring charges, what charges to bring, and how to pursue a case."
What is 'restitution'?,"Restitution is the act of restoring or compensating for loss or damage caused by one's actions, often ordered by a court as part of a criminal sentence."
What is 'immunity' in legal terms?,Immunity is a legal status that protects individuals or entities from being sued or prosecuted under certain conditions.
At what age can someone vote in the US?,The legal age for voting in the United States is 18 years old.
How old must you be to vote in America?,The legal age for voting in the United States is 18 years old.
What age qualifies for voting rights in the United States?,The legal age for voting in the United States is 18 years old.
Why is a power of attorney used?,A power of attorney is a legal document that allows one person to act on behalf of another in legal or financial matters.
What function does a power of attorney serve?,A power of attorney is a legal document that allows one person to act on behalf of another in legal or financial matters.
What role does a power of attorney play?,A power of attorney is a legal document that allows one person to act on behalf of another in legal or financial matters.
What bankruptcy options do individuals have?,The main types of bankruptcy available to individuals are Chapter 7 and Chapter 13 bankruptcy.
Which kinds of bankruptcy can individuals file for?,The main types of bankruptcy available to individuals are Chapter 7 and Chapter 13 bankruptcy.
What types of bankruptcy exist for personal filing?,The main types of bankruptcy available to individuals are Chapter 7 and Chapter 13 bankruptcy.
How would you define a class action lawsuit?,A class action lawsuit is a legal case filed by one or more plaintiffs on behalf of a larger group of people who are similarly affected.
What constitutes a class action lawsuit?,A class action lawsuit is a legal case filed by one or more plaintiffs on behalf of a larger group of people who are similarly affected.
What is meant by a class action lawsuit?,A class action lawsuit is a legal case filed by one or more plaintiffs on behalf of a larger group of people who are similarly affected.
What is a deed in real estate?,A deed is a legal document that transfers ownership of real property from one party to another. It must be signed by the grantor and delivered to the grantee to be legally effective.
What is the difference between a warranty deed and a quitclaim deed?,"A warranty deed guarantees that the grantor holds clear title to the property and has the right to sell it, free of any liens or encumbrances. A quitclaim deed transfers only the interest the grantor has in the property without any guarantees or warranties."
What is an easement in real estate?,"An easement is a legal right to use another person's land for a specific purpose, such as access to a road or utility lines. It does not transfer ownership but grants certain usage rights."
What is a mortgage?,"A mortgage is a loan secured by real property, typically used to purchase the property. The borrower agrees to repay the loan with interest over a specified period, and the lender can foreclose on the property if the borrower defaults."
What is foreclosure?,Foreclosure is the legal process by which a lender takes possession of a property from a borrower who has defaulted on their mortgage payments. The lender then sells the property to recover the loan amount.
What is a lien in real estate?,"A lien is a legal claim against a property as security for the payment of a debt or obligation. Liens can be voluntary, such as a mortgage, or involuntary, such as a tax lien or mechanic's lien."
What is title insurance?,"Title insurance protects property buyers and lenders against losses arising from defects in the title, such as liens, encumbrances, or errors in the property records. It ensures that the buyer has clear ownership of the property."
What is zoning in real estate?,"Zoning refers to the laws and regulations that govern how land can be used in specific areas. Zoning laws designate areas for residential, commercial, industrial, or agricultural use and may impose restrictions on building types, sizes, and densities."
What is a lease agreement?,"A lease agreement is a contract between a landlord and tenant that outlines the terms and conditions of renting a property. It includes details such as the rental amount, duration, responsibilities of both parties, and any restrictions or rules."
What is the difference between a leasehold estate and a freehold estate?,"A leasehold estate grants the tenant the right to use and occupy the property for a specified period under a lease agreement, while a freehold estate grants the owner indefinite ownership rights to the property."
What is a real estate closing?,"A real estate closing is the final step in a property transaction where the buyer and seller sign the necessary documents, the buyer pays the purchase price, and ownership is officially transferred from the seller to the buyer."
What is earnest money in real estate?,Earnest money is a deposit made by the buyer to demonstrate their serious intent to purchase a property. It is typically held in escrow and applied toward the purchase price at closing or refunded if the sale does not go through.
What is a contingency in a real estate contract?,"A contingency is a condition that must be met for the contract to become binding. Common contingencies include financing approval, home inspection, and appraisal. If the contingencies are not met, the buyer can withdraw from the contract without penalty."
What is a short sale in real estate?,A short sale occurs when a property is sold for less than the amount owed on the mortgage with the lender's approval. It is typically used as an alternative to foreclosure when the borrower is unable to repay the loan.
What is an appraisal in real estate?,"An appraisal is an evaluation of a property's value conducted by a licensed appraiser. It considers factors such as the property's condition, location, and recent sales of comparable properties to determine its market value."
What is a real estate agent's fiduciary duty?,"A real estate agent's fiduciary duty is the obligation to act in the best interests of their client. This includes duties of loyalty, confidentiality, disclosure, obedience, accounting, and reasonable care."
What is a property disclosure statement?,A property disclosure statement is a document provided by the seller that discloses known defects or issues with the property. It helps inform the buyer about the property's condition before completing the purchase.
What is escrow in real estate?,Escrow is a financial arrangement where a third party holds and manages funds or documents on behalf of the buyer and seller until all conditions of the sale are met. It provides security for both parties during the transaction.
What is a real estate investment trust (REIT)?,"A real estate investment trust (REIT) is a company that owns, operates, or finances income-producing real estate. Investors can buy shares in the REIT, providing them with a way to invest in real estate without directly owning properties."
What is a deed restriction?,"A deed restriction is a provision in a deed that limits how the property can be used or developed. Common restrictions include prohibiting commercial use, limiting building heights, or requiring certain architectural styles."
What is a tenancy in common?,Tenancy in common is a form of property ownership where two or more individuals hold an undivided interest in the property. Each tenant has the right to use the entire property and can sell or transfer their interest independently.
What is a joint tenancy?,"Joint tenancy is a form of property ownership where two or more individuals hold equal shares of the property with the right of survivorship. Upon the death of one tenant, their share automatically passes to the surviving tenant(s)."
What is a real estate broker?,A real estate broker is a licensed professional who facilitates real estate transactions between buyers and sellers. Brokers typically have more education and experience than real estate agents and may manage their own brokerage firms.
What is a homeowners' association (HOA)?,"A homeowners' association (HOA) is an organization that manages and regulates a residential community. HOAs enforce rules, maintain common areas, and collect dues from property owners to fund community services and improvements."
What is a property tax?,"Property tax is a tax levied by local governments on real estate properties based on their assessed value. Property taxes fund public services such as schools, infrastructure, and emergency services."
What is a mechanic's lien?,"A mechanic's lien is a legal claim against a property filed by contractors, subcontractors, or suppliers who have provided labor or materials for improvements but have not been paid. It secures payment for the work performed."
What is the difference between a buyer's agent and a seller's agent?,"A buyer's agent represents the interests of the buyer in a real estate transaction, while a seller's agent (or listing agent) represents the interests of the seller. Each agent has fiduciary duties to their respective clients."
What is a title search?,"A title search is a process of examining public records to verify the legal ownership of a property and identify any liens, encumbrances, or defects in the title. It ensures the buyer receives clear ownership of the property."
What is a condominium?,"A condominium is a type of real estate where individuals own individual units within a multi-unit building or complex. Owners share common areas and amenities, and a condominium association typically manages the property."
What is a co-op in real estate?,"A co-op (cooperative) is a type of real estate ownership where residents own shares in a corporation that owns the entire property. Instead of owning individual units, residents have the right to occupy a specific unit based on their shares."
What is real property?,"Real property refers to land and any permanent structures attached to it, such as buildings or houses. It includes the rights and interests associated with owning the land and improvements."
What is a real estate transfer tax?,"A real estate transfer tax is a tax imposed by state or local governments on the transfer of property ownership. The tax amount is typically based on the property's sale price and is paid by either the buyer, the seller, or both."
What is a building code?,"Building codes are regulations established by local governments that set standards for the design, construction, and maintenance of buildings to ensure safety, health, and accessibility. Compliance is required for new construction and renovations."
What is a real estate disclosure law?,Real estate disclosure laws require sellers to inform potential buyers of known defects or issues with the property. These laws vary by state but generally aim to ensure transparency and protect buyers from hidden problems.
